id,created_at,text
852574304931852289,2017-04-13 17:28:49,"b'Just saw the trailer of @SachinTheFilm, eagerly waiting for the release. \xf0\x9f\x98\x8a Congrats Paaji! \n#SachinTrailer : https://t.co/OQzdEaT8QM'"
852514158486605825,2017-04-13 13:29:48,b'Good luck @daruvalajehan for your @fiaf3europe debut. Bring home some more silverware. 30 races.. 30 podiums.. No pressure :) Make us proud!'
850603433686183936,2017-04-08 06:57:16,"b""Here's to the breakaway team! \xf0\x9f\x91\x8d\xf0\x9f\x94\x9d @RCBTweets @StayWrogn #RCBvsDD #IPL10 https://t.co/8ZkcjEy1CG"""
850303826435297281,2017-04-07 11:06:44,b'Take on the world. Then make it yours. @PUMA https://t.co/UiBNIV64zb https://t.co/tgijpKTtt4'
850235503899164672,2017-04-07 06:35:15,b'Shoot time. Driving the boys around. \xf0\x9f\x98\x8e\xf0\x9f\x99\x88\xf0\x9f\x98\x82. Ah love these moments. \xf0\x9f\x91\x8d\xf0\x9f\x91\x8d https://t.co/y7AdwU56l9'
849962173766021120,2017-04-06 12:29:08,b'Great session today with the best in the world. Progress going well &amp; on course to come back soon &amp; entertain every\xe2\x80\xa6 https://t.co/WdGUCUci5G'
849862271782277121,2017-04-06 05:52:09,b'Watch me leave a tread where there isn\xe2\x80\x99t one #TreadAnywhere with the #MRFWanderer\nhttps://t.co/Gic6hB7EgX'
849528226095476736,2017-04-05 07:44:47,"b""The trick is to make the best of every minute and although the minutes are not mine today, it'll definitely be your\xe2\x80\xa6 https://t.co/bRSYGcAzla"""
849192795889963008,2017-04-04 09:31:54,b'The spirit of Cricket Selfie. Let the best league in the world commence \xf0\x9f\x98\x8a\xf0\x9f\x91\x8d\xf0\x9f\x91\x8c. #IPL10 #SpiritOfCricket https://t.co/ayYHW8cWCT'
848904580788350977,2017-04-03 14:26:38,b'Back with the Boss Mr. Shankar Basu. Always good seeing the guy who transformed my fitness totally. \xf0\x9f\x91\x8c\xf0\x9f\x94\x9d https://t.co/lHCCTCzb5T'
848549782629036035,2017-04-02 14:56:48,"b""What a day in our lives. One I can never forget. 02/04/2011 is engraved in my and every Indian's heart forever. Jai\xe2\x80\xa6 https://t.co/SNeenzI4hJ"""
848424440354529280,2017-04-02 06:38:44,b'Unconditional love \xf0\x9f\x98\x8d\xf0\x9f\x90\xb6\xf0\x9f\x90\xb6\xf0\x9f\x98\x8d. Thanks for the concern and the wishes people. Keep supporting @RCBTweets for a strong star\xe2\x80\xa6 https://t.co/d0vtigDk9u'
848166765775523840,2017-04-01 13:34:49,b'Thanks to this gem of a human being for working so hard with the injury. Works tirelessly and never complains. Than\xe2\x80\xa6 https://t.co/IzihSFhdTz'
848049044345769984,2017-04-01 05:47:02,b'@Twitter Feels fantastic. \xf0\x9f\x98\x80 https://t.co/XqeO6DU0ki'
848046086136766464,2017-04-01 05:35:17,b'@hardikpandya7 Thanks Pandya.. Take care and feel better. \xf0\x9f\xa4\x97'
848045891621711872,2017-04-01 05:34:31,"b""@cheteshwar1 Thanks Puji.. Enjoy this little break, you've earned it. \xf0\x9f\x98\x87"""
848045463328747520,2017-04-01 05:32:49,b'@MishiAmit Thanks Mishi. \xe2\x98\xba\xef\xb8\x8f'
847724900416503808,2017-03-31 08:19:00,b'Come join me in #Selfiestan starting today with Gionee A1 and start clicking super selfies. #BeA1 \xf0\x9f\x98\x89\xe2\x80\xa6 https://t.co/U9CRrsN4ST'
847712374614179842,2017-03-31 07:29:14,"b'@harbhajan_singh thank you Bhajju Paa, see you soon \xf0\x9f\x98\x80'"
847712026088554497,2017-03-31 07:27:51,b'@Pvsindhu1 thank you for the wishes. \xf0\x9f\x99\x82'
847711861558489092,2017-03-31 07:27:12,"b'@BCCI Thank you, it is indeed an honor. \xf0\x9f\x98\x87'"
847711552123711488,2017-03-31 07:25:58,b'@klrahul11 Thanks bro \xf0\x9f\x98\x8a'
847711433949298688,2017-03-31 07:25:30,b'@SDhawan25 Thanks Jatt Ji \xf0\x9f\x98\x8a'
847711205326176256,2017-03-31 07:24:35,"b'@ashwinravi99 Thanks Ash, looking forward for more Padma Shris in the team. \xf0\x9f\x98\x89'"
847456321666293760,2017-03-30 14:31:46,"b""What an absolute honor and a memorable day to receive the Padma Shri award from the President of India. God's been\xe2\x80\xa6 https://t.co/1zOb9EZ3we"""
847374668143120384,2017-03-30 09:07:19,"b""Help @VOSD1 bring home 100 #PatriotDogs! They spend their lives serving us, it's time to do something for them.\xe2\x80\xa6 https://t.co/PkAwAEwC1i"""
847295042226077697,2017-03-30 03:50:54,"b""2/2only a couple of individuals.I continue to be in good terms with the few guys I know &amp; who I've played with at RCB &amp; that doesn't change."""
847294937041313792,2017-03-30 03:50:29,b'1/2 My answer at the post match conference has been blown way out of proportion. I did not categorically say the whole Australian team but'
847030883194425344,2017-03-29 10:21:14,b'Really happy and delighted to see the grit and determination of this guy. Well done Puji @cheteshwar1 for an outsta\xe2\x80\xa6 https://t.co/UhfxCLJjGf'
846753408908447744,2017-03-28 15:58:39,b'RT @StayWrogn: Good to be back on top. https://t.co/A9OykKr66Q'
846666674057052160,2017-03-28 10:14:00,b'Proud to be a part of this group. Outstanding effort to win this game &amp; the series. Jai Hind \xf0\x9f\x87\xae\xf0\x9f\x87\xb3 https://t.co/9lTnkiig7i'
844921933036687360,2017-03-23 14:41:01,"b""RT @MuveAcoustics: Don't look back you're not going that way. #MuveAcoustics #SoundThatInspires #artbasel https://t.co/MUNUTYyHDp"""
844117336508551169,2017-03-21 09:23:50,b'Off to Dharamshala for the last one. With the bowling machine \xe2\x9c\x8c\xef\xb8\x8f\xf0\x9f\x98\x8e\xf0\x9f\x9b\xab @imjadeja https://t.co/OAG8Kgh57B'
841916508104196097,2017-03-15 07:38:32,b'Guess where we went Wrogn\xc2\xa0this season! An all-new collection of breakaway\xc2\xa0youth fashion is now available at Jabong\xe2\x80\xa6 https://t.co/Vi9kKUv0dl'
841172435886063616,2017-03-13 06:21:51,b'Happy Holi everybody. Have a great day today \xf0\x9f\x99\x8f\xf0\x9f\x8f\xbc\xf0\x9f\x98\x87. Please make sure no harm is done to the animals on the streets. G\xe2\x80\xa6 https://t.co/zP3sItQZIu'
841164507409969153,2017-03-13 05:50:21,b'Have a very Happy and a Safe #Holi everyone. Please take care of the silent ones. #HappyHoli #SafeHoli https://t.co/pn7Upm8xJM'
840859283558395904,2017-03-12 09:37:30,b'#CISF always makes sure of safe &amp; smooth Airport arrivals &amp; departures for me. Thank u @CISFHQrs for always steppin\xe2\x80\xa6 https://t.co/vMLOrWkEls'
840460245101080576,2017-03-11 07:11:52,"b""About last night at this cool new spot in Delhi called 'Nueva' with the super chef Mr @TheMichaelSwamy. Loved the f\xe2\x80\xa6 https://t.co/U1aNIFyNhy"""
840129387932483584,2017-03-10 09:17:09,b'Detox at home \xf0\x9f\x98\x83\xf0\x9f\x91\x8c. Love it \xf0\x9f\x94\x9d\xf0\x9f\x92\xaf\xf0\x9f\x92\xaf https://t.co/UvgJgF5g2F'
840092106664296448,2017-03-10 06:49:01,b'Congratulations @Herbalife on stepping up to start the R&amp;D operations in India. \xf0\x9f\x91\x8d'
839807771117772801,2017-03-09 11:59:10,b'#Grateful to be able to receive the @BCCI Polly Umrigar Trophy for the third time. Thanks to all those who have bel\xe2\x80\xa6 https://t.co/drlF9yIwhG'
839767154065047552,2017-03-09 09:17:46,b'#ImReady to take on every challenge that comes my way. Don\xe2\x80\x99t believe me? Just watch! @AmtouristerIN https://t.co/tBBdpVhZYo'
839731037198483456,2017-03-09 06:54:15,b'Want to see what happens when challenges come my way? Head to @AMTouristerIN to know. #ImReady https://t.co/o7DEdBAhIu'
839531205141938177,2017-03-08 17:40:11,"b'RT @TheMichaelSwamy: @imVkohli Heartfelt thanks for launching my book #ComfortFood. I take the opportunity to invite you at #Nueva, my 1st\xe2\x80\xa6'"
839531163379187712,2017-03-08 17:40:01,"b'@TheMichaelSwamy Great job Chef, Looking forward to visit soon! :) Wish you all the luck for the new restaurant.'"
839359741621071872,2017-03-08 06:18:51,"b""This one's for the ladies. Together we are #STROGN. Happy Women's Day. @StayWrogn \n#InternationalWomensDay https://t.co/KAXv4SUHrm"""
839080752960552960,2017-03-07 11:50:15,b'Special day this. We are a team. We win together we lose together. Proud of you boys. Jai Hind \xf0\x9f\x87\xae\xf0\x9f\x87\xb3 https://t.co/nhmeI8YTvq'
837247888971419653,2017-03-02 10:27:06,"b'Guys, I was at the @PUMA store this morning.. Check it out! Waiting to hear your style tips, help me be\xe2\x80\xa6 https://t.co/UXySUq5BAg'"
836936632100061185,2017-03-01 13:50:17,b'Thanks for the welcome @TheBorisBecker. Would love to catch up and get into the mind of a champion   like you. \xf0\x9f\x98\x8a\xf0\x9f\x91\x8d\xe2\x80\xa6 https://t.co/49xBf1RVO6'
836113272445124608,2017-02-27 07:18:33,b'Everyday is a blessing and an opportunity. Be grateful and keep moving ahead. \xf0\x9f\x98\x87\xe2\x9c\x8c\xef\xb8\x8f https://t.co/zaq1gPlkwR'
834348568190271490,2017-02-22 10:26:14,b'Game Time! Let\xe2\x80\x99s do this! #indvsaus #SoundThatInspires #InsideIsEverything @MuveAcoustics https://t.co/er69y3f9x0'
834004620557029376,2017-02-21 11:39:31,"b'@PUMA Great to be on board, looking forward to get more #Faster. \xf0\x9f\x98\x80 #ForeverFaster'"
833736231376809984,2017-02-20 17:53:02,"b""@cesc4official @PUMA Muchas Gracias for the great present, you're a champion. \xc2\xa1Espera tu sorpresa! \xf0\x9f\x98\x80\xf0\x9f\x91\x9f #ForeverFaster"""
833695709631303680,2017-02-20 15:12:01,"b'Last night we saw @PoornaTheFilm, and must I say its an inspirational story for everyone. Hats off!!'"
833659783320305664,2017-02-20 12:49:15,b'I wish I could get as fast as you someday @usainbolt. Thanks legend. @PUMA  #ForeverFaster'
833316633124995072,2017-02-19 14:05:42,b'A new era begins now. With @PUMA. #Forever #ForeverFaster https://t.co/3d4rS3aHou'
832986268334178304,2017-02-18 16:12:57,b'Tomorrow. The big day. Secret revealed. Ready? #Forever https://t.co/S9RaLlRQA4'
832865663710593024,2017-02-18 08:13:42,b'Interacting with these little angels is blissful. Such innocence and transparency about them. Amazing \xf0\x9f\x98\x87\xf0\x9f\x98\x83 https://t.co/KUbxAxSxHK'
832815255755640832,2017-02-18 04:53:24,b'I love this book. A must read for all those who are brave enough to let their thoughts and ideologies be challenged\xe2\x80\xa6 https://t.co/bBStYrJSqw'
832589604930908160,2017-02-17 13:56:45,"b'Happy Birthday @ABdeVilliers17, the most explosive batsman in the world. Hope you have a good one, see you soon! \xf0\x9f\x98\x89'"
832057642726129665,2017-02-16 02:42:55,b'The feeling you get when the morning rays hit you is bliss \xf0\x9f\x91\x8c\xf0\x9f\x8f\xbc\xf0\x9f\x98\x87. Have a great day world. Make most of it \xf0\x9f\x98\x8a https://t.co/t95fjkoImM'
831550432308768768,2017-02-14 17:07:27,"b'Thanks @sachin_rt Paaji, your wishes mean the world. \xf0\x9f\xa4\x97'"
831430545166958593,2017-02-14 09:11:03,b'The right nutrition is the key to my fitness. How do you power your purpose? @Herbalife  #HerbalifeNutrition\xe2\x80\xa6 https://t.co/Ze1MMyWZNo'
831179435445481472,2017-02-13 16:33:14,b'Tired. Content. Waiting to board\xf0\x9f\x9b\xab\xf0\x9f\x9b\xab https://t.co/99nTKg3DXZ'
828951424327438336,2017-02-07 12:59:55,"b""So everyone. What's the big secret? #Forever https://t.co/3gWMLKZWCL"""
828851387043835905,2017-02-07 06:22:24,b'Breakfast with the boys \xe2\x9c\x8c\xf0\x9f\x8f\xbbGood sunny day in Hyderabad \xf0\x9f\x91\x8c\xf0\x9f\x8f\xbb\xf0\x9f\x8c\x9e Have a great day all of you \xf0\x9f\x98\x8e\nWith @klrahul11\xe2\x80\xa6 https://t.co/sT5qU704iW'
828632775284625413,2017-02-06 15:53:43,"b""When you've got something to tell the world. But you can't yet. #Forever https://t.co/bkzUaZ1mG6"""
827419943012544512,2017-02-03 07:34:21,"b""The time has come, I'm proud to share my life story with you exclusively on\xc2\xa0https://t.co/neBTaJE07J\xe2\x80\xa6 https://t.co/TXqXUkooL4"""
827118514511175681,2017-02-02 11:36:35,"b'As promised, tomorrow i will show you the complete video of my life story on\xc2\xa0https://t.co/neBTaJE07J.\xe2\x80\xa6 https://t.co/BqVQEHU4pm'"
826857776609710081,2017-02-01 18:20:30,b'What a victory \xf0\x9f\x87\xae\xf0\x9f\x87\xb3 \xf0\x9f\x91\x8d\xf0\x9f\x87\xae\xf0\x9f\x87\xb3 \xf0\x9f\x98\x81. @YUVSTRONG12  @msdhoni and Ashu  Bhai. Well done fellas https://t.co/VF5ANvjLyi'
825992926886891520,2017-01-30 09:03:54,b'Major Throwback \xf0\x9f\x98\x8e\xf0\x9f\x98\x8e Good Old Days \xf0\x9f\x98\x8a\xf0\x9f\x98\x8a https://t.co/B91eQPGmlE'
824854303542095872,2017-01-27 05:39:25,"b""It's a privilege to be awarded with Padmashree &amp; to announce it on the 68th Republic Day made it even more special.\nhttps://t.co/n2YQoePEBs"""
824516451180634113,2017-01-26 07:16:55,b'This show is like the Hera Pheri of Cricket. Must watch! https://t.co/KXvQx2UyiB @virendersehwag'
824501031283224576,2017-01-26 06:15:39,b'Happy Republic Day everyone. More power to all out there to make a positive change around you. Jai Hind \xf0\x9f\x87\xae\xf0\x9f\x87\xb3\xf0\x9f\x87\xae\xf0\x9f\x87\xb3\xf0\x9f\x87\xae\xf0\x9f\x87\xb3\xe2\x80\xa6 https://t.co/TQ6O5Lahz6'
824488449138954240,2017-01-26 05:25:39,"b""Gantantra Diwas ki sabhi deshwasiyo'n ko bohat bohat shubhkaamnayein. Humara Tiranga humesha lehrata rahe, Jai Hind! https://t.co/UCpU8vjMaF"""
822689445778456576,2017-01-21 06:17:03,b'Big thanks to all the fans. \xf0\x9f\x91\x8d\xf0\x9f\x91\x8d. Have a great day. #makemostofit #makeadifference https://t.co/96udKNYgoU'
822348832134397952,2017-01-20 07:43:34,"b""Here's a snippet of my life story. Keep checking back for more.\n@MuveAcoustics #InsideIsEverything\xe2\x80\xa6 https://t.co/rnrhYQYtaZ"""
820920367027982336,2017-01-16 09:07:22,b'Starting the week on a positive note \xf0\x9f\x98\x87 @MuveAcoustics \nhttps://t.co/3jeKFGJwVl\n#InsideIsEverything #Inspired https://t.co/wWWmsiGsY0'
820894278222131200,2017-01-16 07:23:42,"b'Thanks @nassercricket, it was great chatting with you! \xe2\x98\xba\xef\xb8\x8f https://t.co/Hyag4qqPMS'"
820275476539142149,2017-01-14 14:24:48,"b""Love the sound of my A+ wireless speakers @MuveAcoustics \nIt's my favorite \xf0\x9f\x98\x8e #SoundThatInspires #Inspired\xe2\x80\xa6 https://t.co/laOvE5hxZu"""
820157205693415424,2017-01-14 06:34:50,"b'Music has always motivated &amp; inspired me. Delighted to announce my 2 year labour of love, @MuveAcoustics \n#Inspired\xe2\x80\xa6 https://t.co/RijvpZkT9B'"
819463366800310272,2017-01-12 08:37:46,b'Good old days \xf0\x9f\x98\x82\xf0\x9f\x98\x82\nSpot me in the picture \xf0\x9f\x91\x80 \xf0\x9f\xa4\x93\n#Throwback https://t.co/1ge18EReDT'
819060008713416704,2017-01-11 05:54:58,b'Happy Birthday Rahul Bhai. Thank you for your encouragement &amp; for being a great role model for all the budding cricketers out there \xf0\x9f\x98\x87'
819043195036106752,2017-01-11 04:48:09,b'Enroute Pune \xf0\x9f\x98\x8e\xf0\x9f\x98\x8e @klrahul11 https://t.co/larTcyLp0o'
818446157923942400,2017-01-09 13:15:44,"b'A new year. A new start. And a new reason to #MakeSmiles, @GioneeIndia\n@ArvindRVohra https://t.co/svX2VVzbym'"
817742095427502080,2017-01-07 14:38:03,"b'RT @BCCI: MUST WATCH: Up close &amp; personal with Captain @imVkohli - on @msdhoni, 2019 @cricketworldcup road map &amp; more https://t.co/IJXlzvPk\xe2\x80\xa6'"
817239110909710337,2017-01-06 05:19:22,b'Change your thinking and the world will change around you. https://t.co/FinDIYv2aV'
817230961116999680,2017-01-06 04:46:59,"b""This country should be safe &amp; equal for all. Women shouldn't be treated differently. Let's stand together &amp; put an\xe2\x80\xa6 https://t.co/5mtdCKkHMm"""
817219571388137476,2017-01-06 04:01:43,"b""Thanks for always being the leader a youngster wants to have around him. You'll always be my captain @msdhoni Bhai \xf0\x9f\x98\x8a\xf0\x9f\x98\x8a"""
816669225255211009,2017-01-04 15:34:50,"b""Backing the Blue always. A record 4th title for the girls. Congratulations to the Women's Football Team \xf0\x9f\x92\xaa\xf0\x9f\x91\x8c https://t.co/dLEwZsyCFc"""
816650704286666752,2017-01-04 14:21:15,b'The feeling of seeing my brand new cricket gear has not changed since childhood. That same old excitement &amp; happine\xe2\x80\xa6 https://t.co/RxRsKgmqTv'
815969343565537280,2017-01-02 17:13:46,"b""Couldn't be a better resolution than to get fitter from inside out. Work hard at something every day \xe2\x9c\x8c\xf0\x9f\x91\x8d\xf0\x9f\x91\x8d https://t.co/loMSpfBOv2"""
815516165904547840,2017-01-01 11:13:00,b'Happy Happy Happy New Year everybody. Kickstart your year with a good deed. God Bless All \xf0\x9f\x98\x87\xf0\x9f\x98\x87#PositiveStart https://t.co/e737iInn69'
815098651819339776,2016-12-31 07:33:57,"b""RT @KP24: I'm batting for rhinos tomorrow in the Melbourne derby at the MCG. Poaching our beautiful animals disgusts me &amp; I'm all for helpi\xe2\x80\xa6"""
814700397012992001,2016-12-30 05:11:25,"b'(2/2)Since news channels cant resist selling false rumours &amp; keeping you confused, we are just ending the confusion :)'"
814699989066620928,2016-12-30 05:09:48,"b'"" we aren\'t getting engaged &amp; if we were going to,we wouldn\'t hide it. Simple... (1/2)'"
813014088884355073,2016-12-25 13:30:38,b'Thank you @narendramodi Sir for all the kind words; your support will always help us strive for better. @BCCI\xe2\x80\xa6 https://t.co/z6IPydvjbp'
813004646730133504,2016-12-25 12:53:07,b'Merry Christmas everyone. \xf0\x9f\x8e\x84 \xf0\x9f\x8e\x84 I hope all of you have a great day. \xf0\x9f\x91\x8d \xf0\x9f\x98\x8a https://t.co/Cs1zAT2ZUM'
812567881594638336,2016-12-24 07:57:34,"b'Well done boys on winning the #YouthAsiaCup  2016 Title, heartiest congratulations to the India U-19 Team, #RahulDravid and @BCCI #AsiaCup'"
812539223005941760,2016-12-24 06:03:41,b'My mantra for 2017:Follow my instincts &amp; make my own choices\nRead the letter:https://t.co/O4vI1BEJwH\n#BoldMove #Spon\nhttps://t.co/yzqUc1DC4Q'
811427349191266304,2016-12-21 04:25:30,b'Always a good chat with my man Mr. Sridhar. Off for a long break before we hit the road again \xf0\x9f\x87\xae\xf0\x9f\x87\xb3\xf0\x9f\x98\x8e\xf0\x9f\x87\xae\xf0\x9f\x87\xb3 https://t.co/t8aQxe5glv'
811194806034526209,2016-12-20 13:01:27,b'These are the moments u cherish all your life. So proud of these guys for putting in all they had.\nThis is more tha\xe2\x80\xa6 https://t.co/C5BEVmkk6B'
808577659529674752,2016-12-13 07:41:51,b'A team effort &amp; a memorable one! Thank you everyone for the wishes &amp; kind words. #Grateful \xf0\x9f\x98\x87 https://t.co/Bgoo9hX30G'
805747366481383424,2016-12-05 12:15:16,b'Very important every now and then to introspect and understand yourself \xf0\x9f\x92\xad \xf0\x9f\x98\x87 https://t.co/QGIXpdT955'
805743221963792384,2016-12-05 11:58:48,b'Wish you a very Happy Birthday Jatt ji @SDhawan25 \xf0\x9f\x98\x8a\xf0\x9f\x98\x8a'
804221745351639040,2016-12-01 07:13:00,b'The naughty one coming to the airport to see me off. Crazy how quickly kids evolve \xf0\x9f\x92\x9c\xf0\x9f\x92\x9c \n#TimeToFly \xe2\x9c\x88\xe2\x9c\x88 https://t.co/3KEWFY0gSy'
804167753254903812,2016-12-01 03:38:27,"b""That feeling of seeing a foggy winter morning after ages! \xf0\x9f\x98\x8e\xf0\x9f\x98\x8e Oh btw, that's my new @StayWrogn hoodie! It's super co\xe2\x80\xa6 https://t.co/NiKJUz1EsS"""
803891121214472193,2016-11-30 09:19:13,b'A lazy day at home is all you need after a hard fought game. \xe2\x9c\x8c\xe2\x9c\x8c https://t.co/EmsdCBVthQ'
801300848634691584,2016-11-23 05:46:24,"b'Top man, top words and so true. Respect @TheNotoriousMMA #Legend \xf0\x9f\x99\x8f https://t.co/kB4TwTQYml'"
801085140218757121,2016-11-22 15:29:15,b'What an amazing evening. Thank you Ludhiana for all the love &amp; affection. So so grateful. Until next time\xe2\x80\xa6 https://t.co/4JzklqPOtr'
798776937275539456,2016-11-16 06:37:17,b'Life in a box \xf0\x9f\x8f\x8f\xf0\x9f\x8f\x8f https://t.co/LUiJiB0LKo'
798425277714075652,2016-11-15 07:19:54,"b""The years can't be numbered. @sachin_rt paaji is forever the cricket legend \xf0\x9f\x98\x87 #27YearsOfSachin https://t.co/QAjg4y2W48"""
798085689040482304,2016-11-14 08:50:30,b'The sun is shining in beautiful Vizag. Lovely place. Love coming back here \xf0\x9f\x98\x8e\xf0\x9f\x91\x8c https://t.co/1Oc3AwXvbX'
797100085133787141,2016-11-11 15:34:04,b'Woohoo Forca Goa \xf0\x9f\x91\x8d\xf0\x9f\x91\x8d\nWhat a comeback win. So happy for the boys. Great great stuff @FCGoaOfficial \xf0\x9f\x92\xaa\xf0\x9f\x92\xaa https://t.co/b7lrMqh31M'
795896695900946432,2016-11-08 07:52:14,b'New Cut \xe2\x9c\x82\xe2\x9c\x82\nLighter head always feels great \xf0\x9f\x98\x8e\xf0\x9f\x91\x8c https://t.co/V4yCgIwelF'
795663109515931648,2016-11-07 16:24:02,"b""Please be more aware. The future depends on how we act now. It's heartbreaking to see the pollution levels rise so\xe2\x80\xa6 https://t.co/YNaJhL9wOj"""
795658383223230466,2016-11-07 16:05:15,"b""environment, not for an individual, not for your family but for humanity. Let's not destroy nature, let's not destroy our future #DelhiSmog"""
795658193934221313,2016-11-07 16:04:30,"b'Life is precious &amp; nature is our lifeline. The air we breathe, the water we drink. It is our responsibility to be more conscious towards...'"
795615287735250944,2016-11-07 13:14:01,"b""My Tissot helps me keep a check on time &amp; oozes style. Love it totally \xf0\x9f\x98\x8e\xf0\x9f\x98\x8e\nGet one for yourself people. It's worth i\xe2\x80\xa6 https://t.co/9pf2ulGKqk"""
794929309915848704,2016-11-05 15:48:11,b'Thank you to all my supporters &amp; fan clubs. Thank you for making my day even more special. Always overwhelming to see the efforts you put in'
794929001038893056,2016-11-05 15:46:57,b'Really grateful for all the warm wishes on my birthday. Thank you for the continuous love &amp; support.'
794926980713938944,2016-11-05 15:38:55,b'@Pvsindhu1 : Thank you \xf0\x9f\x98\x8a\xf0\x9f\x98\x8a'
794926900598538240,2016-11-05 15:38:36,b'@NSaina : Thank you \xf0\x9f\x98\x8a\xf0\x9f\x98\x8e'
794915862142599168,2016-11-05 14:54:45,b'Thank you everyone for the wishes. Means a lot \xf0\x9f\x98\x87\xf0\x9f\x98\x8a https://t.co/s7kwJMwaVK'
794915281512468480,2016-11-05 14:52:26,b'@tiwarymanoj : Thank you so much \xf0\x9f\x98\x8a\xf0\x9f\x98\x8a'
794915114625314816,2016-11-05 14:51:46,b'@dindaashoke : Thank you bro \xf0\x9f\x98\x8e\xf0\x9f\x98\x8e'
794910998561816576,2016-11-05 14:35:25,b'@cheteshwar1 : Thank you \xf0\x9f\x98\x8e\xf0\x9f\x98\x8a\xf0\x9f\x98\x8e'
794910952072179714,2016-11-05 14:35:14,b'@y_umesh : Thank you so much \xf0\x9f\x98\x8e\xf0\x9f\x98\x8a'
794909373927591936,2016-11-05 14:28:58,b'Thank you @hardikpandya7 \xf0\x9f\x98\x8e'
794906337889030146,2016-11-05 14:16:54,b'Thank you @anilkumble1074 bhai \xf0\x9f\x98\x8a\xf0\x9f\x98\x8a\xf0\x9f\x98\x87'
794904565892009984,2016-11-05 14:09:51,b'@GautamGambhir : Thank you so much \xf0\x9f\x98\x8a\xf0\x9f\x98\x87'
794903795448692736,2016-11-05 14:06:48,b'@SGanguly99 : Thank you so much \xf0\x9f\x98\x87\xf0\x9f\x99\x8f'
794903601462153216,2016-11-05 14:06:01,b'Thank you @VVSLaxman281 bhai.\nWill definitely try to keep entertaining \xf0\x9f\x98\x87'
794902303476092928,2016-11-05 14:00:52,b'Thank you Bhajju paa \xf0\x9f\x98\x8a\xf0\x9f\x98\x8a https://t.co/gM1fLq3th2'
794901338475917312,2016-11-05 13:57:02,b'@jatinsapru : Thank you so much \xf0\x9f\x98\x8a\xf0\x9f\x98\x8a'
794901245194432515,2016-11-05 13:56:40,b'@iqqiabdullah : Thank you \xf0\x9f\x98\x8a\xf0\x9f\x98\x87\xf0\x9f\x98\x8a'
794901142333333509,2016-11-05 13:56:15,b'@gauravkapur : Hahaha thank you \xf0\x9f\x98\x87\xf0\x9f\x98\x8a'
794900961361694720,2016-11-05 13:55:32,b'@TandonRaveena : Thank you so much \xf0\x9f\x98\x8a\xf0\x9f\x98\x8a'
794900905275506688,2016-11-05 13:55:19,b'@iamyusufpathan : Thank you \xf0\x9f\x98\x8a\xf0\x9f\x98\x8a\xf0\x9f\x98\x8a'
794897230016544768,2016-11-05 13:40:42,b'Thank you paaji @ianuragthakur @BCCI @BCCIdomestic @ICC'
794896901829054466,2016-11-05 13:39:24,b'@rishid100 : Thank you so much'
794896829322145793,2016-11-05 13:39:07,b'@IrfanPathan : Thank you so much'
794896684035624961,2016-11-05 13:38:32,b'@YUVSTRONG12 : Thank you Yuvi paa for the wishes. Means a lot \xf0\x9f\x98\x8a'
794896125593415680,2016-11-05 13:36:19,b'Thank you so much paaji for the wishes \xf0\x9f\x98\x8a\xf0\x9f\x98\x87 https://t.co/yDXdr6DqoW'
794895631437348864,2016-11-05 13:34:21,"b'Hahahaha paaji, thank you so much https://t.co/2rCaBV92q1'"
794895426784620544,2016-11-05 13:33:32,b'@SDhawan25 : Thank you Shikhi \xf0\x9f\x98\x8a'
794895001826144257,2016-11-05 13:31:51,b'@ImRahulSharma3 : Thank You so much'
794450262190497792,2016-11-04 08:04:37,b'I respect women for pushing themselves and setting a benchmark. Join the https://t.co/MRgfvu1kCc &amp; break the guiness world record. #DoYou'
794411900175937537,2016-11-04 05:32:11,b'I believe I can fly!\nThrowback to one of the many practice sessions \xf0\x9f\x91\x8c\xf0\x9f\x91\x8c #LoveWhatIDo https://t.co/ch9x4DZ4xY'
794209236586594305,2016-11-03 16:06:52,"b""Great defending today. It doesn't take time to turn the tide to winning for @FCGoaOfficial @IndSuperLeague #PUNvGOA #ForcaGoa"""
793318175181983744,2016-11-01 05:06:06,b'What are you gonna make of your day today? I am watching so better make it worthwhile.\nHave a productive day you al\xe2\x80\xa6 https://t.co/HndXOLcKTJ'
793017074662543360,2016-10-31 09:09:38,b'Finishing some work and helped by the styling master @apeni_george\nAlways fun to catch up with my squad at work \xf0\x9f\x98\x8e\xf0\x9f\x91\x8c https://t.co/wbWfX10s4p'
792711226878930945,2016-10-30 12:54:19,"b""Hello Goa, I'm here to back the Gaurs. See you all at the Fatorda in a bit! Come on @FCGoaOfficial \xf0\x9f\x92\xaa\xf0\x9f\x92\xaa\n#ForcaGoa #Gaurs @IndSuperLeague"""
792709084910718981,2016-10-30 12:45:48,b'Be compassionate &amp; make a difference starting today. God Bless Everyone. Have a Happy Diwali \xf0\x9f\x99\x8f\xf0\x9f\x99\x8f \xf0\x9f\x98\x87\xf0\x9f\x98\x87 https://t.co/StXssS1dvf'
792387717044645888,2016-10-29 15:28:48,b'Great Series Win. The energy at the stadium today was amazing. Thanks for the support people! \xf0\x9f\x87\xae\xf0\x9f\x87\xb3\xf0\x9f\x87\xae\xf0\x9f\x87\xb3 #IndVNZ https://t.co/sEscoQR6pD'
